{"fixture_id":"r5-missing-installation","template_id":"r5-cbam","description":"Covered goods and quantity exist, but production installation identity is absent.","input_summary":{"cn_code":"72085100","import_quantity":500,"installation_present":false},"expected":{"field_statuses":{"cn_code":"FOUND","import_quantity":"FOUND","installation_name":"MISSING","installation_address":"MISSING"},"clarification_field_ids":["installation_name","installation_address"]},"prohibited_claims":["符合 CBAM 申报要求","应缴证书数已经确定"]}
