{"fixture_id":"r3-partial-framework","template_id":"r3-esg-sustainability","description":"Metrics and targets exist, but governance and scenario evidence are absent.","input_summary":{"reporting_framework":"TCFD","metrics_present":true,"governance_present":false,"scenario_analysis_present":false},"expected":{"field_statuses":{"reporting_frameworks":"FOUND","board_oversight":"MISSING","scenario_pathways":"MISSING"},"clarification_field_ids":[]},"prohibited_claims":["完全符合 TCFD","已完成气候情景分析"]}
