{"fixture_id":"r2-scope2-method-separation","template_id":"r2-organizational-ghg","description":"Inventory has location-based Scope 2 but no market-based result.","input_summary":{"organization_name":"示例组织","reporting_year":2025,"scope2_location":120.0,"scope2_market_present":false},"expected":{"field_statuses":{"scope2_location":"FOUND","scope2_market":"MISSING","total_emissions_location":"CALCULATED"},"clarification_field_ids":[]},"prohibited_claims":["市场法排放为 0","已经第三方核查"]}
