{"fixture_id":"r1-missing-functional-unit","template_id":"r1-product-carbon-footprint","description":"Product data includes stage emissions but omits the quantitative functional unit.","input_summary":{"product_name":"示例产品","stage_emissions_present":true,"functional_unit_present":false},"expected":{"field_statuses":{"product_name":"FOUND","functional_unit":"MISSING","total_product_footprint":"CALCULATED"},"clarification_field_ids":["functional_unit"]},"prohibited_claims":["符合 ISO 14067","已完成第三方核查"]}
