{"fixture_id":"r4-missing-floor-area","template_id":"r4-energy-audit","description":"Energy bills are present but floor area is missing, blocking intensity calculation.","input_summary":{"electricity_consumption":250000,"floor_area_present":false},"expected":{"field_statuses":{"electricity_consumption":"FOUND","floor_area":"MISSING","energy_intensity":"MISSING"},"clarification_field_ids":["floor_area"]},"prohibited_claims":["单位面积能耗为 0","已完成现场能源审计"]}
