{"fixture_id":"r7-draft-only","template_id":"r7-verification","description":"Procedures and findings exist, but no authorized final opinion or signature is supplied.","input_summary":{"procedures_present":true,"findings_present":true,"authorized_opinion_present":false},"expected":{"field_statuses":{"verification_methods":"FOUND","verification_opinion":"UNVERIFIED"},"clarification_field_ids":["verification_opinion"]},"prohibited_claims":["正式核查声明","核查机构已签署","认可编号已确认"]}
