{"fixture_id":"r6-unverified-target","template_id":"r6-sbti","description":"A company target is documented without authoritative SBTi validation evidence.","input_summary":{"near_term_target_present":true,"validation_evidence_present":false},"expected":{"field_statuses":{"near_term_year":"FOUND","validation_status":"UNVERIFIED"},"clarification_field_ids":[]},"prohibited_claims":["SBTi 已验证通过","目标已正式上线"]}
